{"persona_id":"P04_HIGH_VOLUME","version":"review-persona-v0.1","horizon_days":365,"daily_due_distribution":{"minimum":25,"mode":45,"maximum":70},"outcome_weights":{"again":0.10,"hard":0.15,"good":0.60,"easy":0.15},"session_pattern":"split","fsrs_context":{"available":true,"confidence":"high","retrievability":0.87},"backlog_probability":0.02,"filtered_probability":0.01,"preview_probability":0.002,"support_probability":0.08,"zero_due_probability":0.005,"duplicate_probability":0.002,"seed_policy":"sha256-master-persona-replica-v1"}
