{"persona_id":"P08_NO_FSRS","version":"review-persona-v0.1","horizon_days":365,"daily_due_distribution":{"minimum":3,"mode":10,"maximum":18},"outcome_weights":{"again":0.12,"hard":0.18,"good":0.58,"easy":0.12},"session_pattern":"single","fsrs_context":{"available":false,"confidence":"unavailable","retrievability":0.00},"backlog_probability":0.03,"filtered_probability":0.01,"preview_probability":0.005,"support_probability":0.12,"zero_due_probability":0.04,"duplicate_probability":0.001,"seed_policy":"sha256-master-persona-replica-v1"}
