{"persona_id":"P07_IRREGULAR_SCHEDULE","version":"review-persona-v0.1","horizon_days":365,"daily_due_distribution":{"minimum":0,"mode":6,"maximum":25},"outcome_weights":{"again":0.18,"hard":0.22,"good":0.50,"easy":0.10},"session_pattern":"irregular","fsrs_context":{"available":true,"confidence":"medium","retrievability":0.65},"backlog_probability":0.18,"filtered_probability":0.02,"preview_probability":0.01,"support_probability":0.18,"zero_due_probability":0.25,"duplicate_probability":0.003,"seed_policy":"sha256-master-persona-replica-v1"}
